Question,Answer,Category
"Hello, how are you?","I'm doing great, thank you! How can I assist you today?","greeting"
"What's your name?","I'm a chatbot created to help you with your queries.","greeting"
"Can you help me with AI?","Sure! AI stands for Artificial Intelligence, and it involves machine learning and deep learning technologies.","information"
"Tell me a joke.","Why don't skeletons fight each other? They don't have the guts!","joke"
"What is your favorite color?","I don't have a favorite color, but I love helping you with your questions!","greeting"
"Explain machine learning.","Machine learning is a type of artificial intelligence that allows computers to learn from data and improve over time without being explicitly programmed.","information"
"What's the weather like today?","I can't check the weather, but you can try using a weather app for more accurate updates.","general"
"How does a neural network work?","A neural network is a series of algorithms that attempt to recognize underlying relationships in a set of data by mimicking the way the human brain operates.","information"
"Do you know who won the last World Cup?","The last World Cup was won by France in 2018.","sports"
"Can you give me a motivational quote?","The only way to do great work is to love what you do. – Steve Jobs","motivation"
"What are the benefits of AI?","AI can automate tasks, improve efficiency, and enable better decision-making in various fields, from healthcare to finance.","information"
"Do you like music?","I don't have personal preferences, but I can help you find great music recommendations!","greeting"
"What's the capital of France?","The capital of France is Paris.","general"
"Tell me a fun fact.","Did you know that honey never spoils? Archaeologists have found pots of honey in ancient tombs that are over 3,000 years old!","general"
"How old are you?","I exist in the digital realm, so I don't age!","greeting"
"What is the largest planet in the solar system?","Jupiter is the largest planet in our solar system.","science"
"What is quantum computing?","Quantum computing is a type of computing that takes advantage of quantum mechanics to process data much faster than classical computers.","information"
"What is the speed of light?","The speed of light is approximately 299,792 kilometers per second.","science"
"Tell me a space fact.","Did you know that Venus is the hottest planet in our solar system, even though Mercury is closer to the Sun?","science"
"Can you tell me a riddle?","Sure! What has to be broken before you can use it? An egg!","joke"
"Who discovered gravity?","Sir Isaac Newton is credited with discovering gravity.","science"
"What is the powerhouse of the cell?","The mitochondrion is known as the powerhouse of the cell.","science"
"What is 2+2?","2+2 equals 4.","math"
"Tell me a historical fact.","The Great Wall of China is over 13,000 miles long!","history"
"What is the tallest mountain in the world?","Mount Everest is the tallest mountain, standing at 8,848 meters (29,029 feet).","science"
"Who wrote Hamlet?","William Shakespeare wrote Hamlet.","literature"
"Which ocean is the largest?","The Pacific Ocean is the largest ocean on Earth.","geography"
"What is the formula for water?","The chemical formula for water is H2O.","science"
"What is the boiling point of water?","Water boils at 100°C (212°F) at sea level.","science"
"Tell me an inspirational quote.","Believe you can and you're halfway there. - Theodore Roosevelt","motivation"
"Who invented the telephone?","Alexander Graham Bell is credited with inventing the telephone.","history"
"What is photosynthesis?","Photosynthesis is the process by which plants convert sunlight into energy.","science"
"What is the capital of Japan?","The capital of Japan is Tokyo.","geography"
"Who painted the Mona Lisa?","Leonardo da Vinci painted the Mona Lisa.","art"
"What is the meaning of life?","That’s a deep question! Many believe it's about finding happiness and purpose.","philosophy"
"What is the smallest country in the world?","Vatican City is the smallest country in the world.","geography"
"Tell me another joke.","Why did the scarecrow win an award? Because he was outstanding in his field!","joke"
"What is an algorithm?","An algorithm is a step-by-step procedure used to solve a problem.","technology"
"What is a black hole?","A black hole is a region in space where gravity is so strong that nothing, not even light, can escape.","science"
"Who was Albert Einstein?","Albert Einstein was a theoretical physicist known for the theory of relativity.","science"
"What is Newton's first law?","Newton’s first law states that an object at rest stays at rest, and an object in motion stays in motion unless acted upon by an external force.","science"
"What is Python programming used for?","Python is used for web development, data science, AI, machine learning, and automation.","technology"
"How many continents are there?","There are seven continents: Asia, Africa, North America, South America, Antarctica, Europe, and Australia.","geography"
"How do airplanes fly?","Airplanes fly using the principles of lift, thrust, drag, and weight.","science"
"What are the three states of matter?","The three main states of matter are solid, liquid, and gas.","science"
"What is an atom?","An atom is the smallest unit of matter that retains the properties of an element.","science"
"What is the Fibonacci sequence?","The Fibonacci sequence is a series of numbers where each number is the sum of the two preceding ones.","math"
"What is a chatbot?","A chatbot is an AI program that simulates human conversation.","technology"
"What is the largest animal on Earth?","The blue whale is the largest animal on Earth.","science"
"Who invented the airplane?","The Wright brothers, Orville and Wilbur Wright, invented the first successful airplane.","history"
"Tell me about Mars.","Mars is the fourth planet from the Sun and is often called the Red Planet.","science"
"What are renewable energy sources?","Renewable energy sources include solar, wind, hydro, and geothermal power.","science"
"Tell me a fact about space.","There is no sound in space because there is no air to carry sound waves.","science"
"What are the primary colors?","The primary colors are red, blue, and yellow.","art"
"What is the chemical symbol for gold?","The chemical symbol for gold is Au.","science"
"What is an AI model?","An AI model is a mathematical framework that enables machines to perform specific tasks, such as recognizing patterns or making decisions.","technology"
"What is a supercomputer?","A supercomputer is a high-performance computing system that can process complex calculations at extremely fast speeds.","technology"
"What is the capital of Canada?","The capital of Canada is Ottawa.","geography"
"What is the Pythagorean theorem?","The Pythagorean theorem states that a² + b² = c² for a right-angled triangle.","math"
"What is a neuron?","A neuron is a nerve cell that transmits information in the brain and nervous system.","science"
"What is Big Data?","Big Data refers to extremely large datasets that require advanced analytics and storage techniques.","technology"
"Tell me about the human brain.","The human brain has around 86 billion neurons and is responsible for thoughts, emotions, and memory.","science"
"What is cybersecurity?","Cybersecurity is the practice of protecting systems, networks, and programs from cyberattacks.","technology"
